{
  "$schema": "http://json-schema.org/draft-07/schema#",
  "title": "Configuration",
  "type": "object",
  "description": "Configures the source files, page layout, theme, output location, and quality checks used to generate a documentation site.",
  "properties": {
    "$schema": {
      "type": "string",
      "format": "uri-reference",
      "description": "Not recommended in configuration files. Retained only for compatibility. The canonical hosted schema represents the latest Kampose release and may not match an installed or pinned version, and installation-relative schema paths are not portable. Kampose does not use this value during generation. Editors and agents should instead validate out of band using the schema matching every effective Kampose version."
    },
    "baseDirectory": {
      "type": [
        "string",
        "null"
      ],
      "description": "Directory used to resolve relative assembly, XML documentation, topic, asset, and output paths. If null or omitted, the directory containing this configuration file is used."
    },
    "baseUrl": {
      "type": [
        "string",
        "null"
      ],
      "format": "uri",
      "description": "Absolute root URL assigned to the generated documentation site. If null or omitted, generated links are relative so the output can be hosted at any location."
    },
    "assemblies": {
      "type": "array",
      "items": {
        "type": "string"
      },
      "description": "Case-insensitive glob patterns, relative to baseDirectory, that select .NET assemblies to document. Patterns without an extension are treated as .dll patterns. For every matched assembly, a same-named .xml file in the same directory is loaded automatically when present."
    },
    "xmlDocs": {
      "type": "array",
      "items": {
        "type": "string"
      },
      "description": "Case-insensitive glob patterns, relative to baseDirectory, for additional XML documentation files. Patterns without an extension are treated as .xml patterns. Use this field when XML files are not located beside, or are not named after, their assemblies."
    },
    "references": {
      "type": "array",
      "items": {
        "type": "object",
        "properties": {
          "namespaces": {
            "type": "array",
            "items": {
              "type": "string"
            },
            "description": "Case-sensitive namespace patterns whose external types and members use this reference. A pattern may end with a single wildcard (*) segment to match descendant namespaces."
          },
          "strategy": {
            "type": "string",
            "enum": [
              "dotNet",
              "docFx",
              "devOps",
              "gitLab",
              "onlineSearch"
            ],
            "description": "URL convention used to construct links for matching external code elements: .NET API Browser, DocFX, Azure DevOps Wiki, GitLab Wiki, or an online search query."
          },
          "url": {
            "type": [
              "string"
            ],
            "format": "uri",
            "description": "Absolute base URL of the external documentation site, or the search endpoint when strategy is onlineSearch."
          },
          "extension": {
            "type": [
              "string",
              "null"
            ],
            "description": "Override for the page extension produced by a strategy-based reference. Set to an empty or whitespace-only string to omit extensions; use null or omit the field to retain the strategy's default. This field does not affect onlineSearch references."
          }
        },
        "required": [
          "namespaces",
          "strategy",
          "url"
        ],
        "description": "Maps a set of external namespaces to the documentation site and URL convention used to link their types and members.",
        "additionalProperties": false
      },
      "description": "Rules for linking referenced types and members that are not part of the documented assemblies. Rules associate namespace patterns with an external documentation site and URL convention."
    },
    "topics": {
      "type": "array",
      "items": {
        "type": "string"
      },
      "description": "Case-insensitive glob patterns, relative to baseDirectory, that select Markdown topic files such as guides and tutorials. Patterns without an extension are treated as .md patterns. The default selects Markdown files directly inside baseDirectory.",
      "default": ["*.md"]
    },
    "topicOrder": {
      "type": "array",
      "items": {
        "type": "string"
      },
      "description": "Topic paths to place first, in the listed order. Matching is case-insensitive and accepts relative paths or filenames with or without extensions. Unlisted topics follow in alphabetical title order; unmatched entries are ignored. If empty, all topics are sorted alphabetically by title.",
      "default": []
    },
    "topicHierarchy": {
      "type": "string",
      "enum": [
        "none",
        "directory",
        "index",
        "prefix"
      ],
      "description": "Method for deriving parent-child relationships between topics: none keeps every topic at the top level; directory makes a file named after a directory the parent of that directory's files; index uses overview files as parents; prefix groups filenames by dot-separated prefixes.",
      "default": "none"
    },
    "assets": {
      "type": "array",
      "items": {
        "type": "object",
        "properties": {
          "source": {
            "type": "array",
            "items": {
              "type": "string"
            },
            "description": "Case-insensitive glob patterns, relative to baseDirectory, that select files to copy unchanged. For each include, the directory prefix before its first wildcard is the hierarchy root; each match retains its path relative to that root. An exact-file include uses the file's containing directory as its root. Prefix a pattern with ! to exclude matches without changing an include's root. If multiple includes select one file with different retained paths, the rule is invalid."
          },
          "targetPath": {
            "type": "string",
            "description": "Destination directory under outputDirectory. Each match's hierarchy-relative path is appended beneath this directory. The value must be relative and cannot contain parent-directory segments. An empty or omitted value preserves the hierarchy directly beneath outputDirectory."
          }
        },
        "required": [
          "source"
        ],
        "description": "Selects static files and the output subdirectory into which they are copied.",
        "additionalProperties": false
      },
      "description": "Static asset copy rules for files such as images, stylesheets, and scripts. Assets are copied unchanged with their include-relative hierarchy preserved. Complete generated paths must be unique; collisions are rejected."
    },
    "outputDirectory": {
      "type": "string",
      "description": "Directory that receives generated pages, theme bundles, and copied assets. A relative path is resolved against baseDirectory. The directory is created when needed and may be cleared first when the build command uses --clean."
    },
    "convention": {
      "type": "string",
      "enum": [
        "dotNet",
        "dotnet",
        "docFx",
        "docfx",
        "devOps",
        "devops",
        "gitLab",
        "gitlab"
      ],
      "description": "Determines output format, page grouping, URL layout, and the directory from which built-in themes are loaded. dotNet generates HTML with separate type and member pages; docFx generates HTML with members on their type pages; devOps generates Markdown for Azure DevOps Wiki; gitLab generates Markdown for GitLab Wiki.",
      "default": "docFx"
    },
    "theme": {
      "type": "string",
      "description": "Theme directory to load for the selected convention. Use a built-in theme name such as \"classic\" or an absolute path to a custom theme directory containing theme.json. Relative values are resolved beneath Kampose's format-specific themes directory.",
      "default": "classic"
    },
    "themeSettings": {
      "type": "object",
      "description": "Values supplied to the selected theme. A non-null value overrides the parameter's default from theme.json; unknown names are still exposed to templates and scripts for custom use. Names that conflict with built-in global template values are ignored with a warning. Parameter names are matched case-insensitively.",
      "propertyNames": {
        "type": "string"
      },
      "additionalProperties": {
        "type": [
          "string",
          "number",
          "boolean",
          "null",
          "array",
          "object"
        ]
      }
    },
    "audit": {
      "type": "object",
      "description": "Controls the XML documentation completeness checks, which run before any page is generated, and the link validation, which runs against the generated files after the pages are generated. Internal links must refer to a file generated by the same run, and a fragment in a link to a generated HTML page must name an id, or the name of an a element, on that page.",
      "properties": {
        "options": {
          "type": "array",
          "items": {
            "type": "string",
            "enum": [
              "summary",
              "remarks",
              "example",
              "typeparam",
              "param",
              "returns",
              "value",
              "exception",
              "permission",
              "event",
              "seeAlso",
              "threadSafety",
              "overloads",
              "required",
              "recommended",
              "all"
            ]
          },
          "description": "XML documentation elements or rule groups to inspect. Use required for minimum requirements, recommended for suggested elements, all for every supported check, or list individual element names. An empty array disables XML documentation inspection but does not disable link checking.",
          "default": [
            "required"
          ]
        },
        "includeImplicitConstructors": {
          "type": "boolean",
          "description": "Whether compiler-generated public constructors must satisfy the selected XML documentation checks. They are omitted from inspection by default.",
          "default": false
        },
        "verifyExternalLinks": {
          "type": "boolean",
          "description": "Whether link validation may make network requests to check external URLs found in XML comments and Markdown topics. Internal references are validated regardless of this setting.",
          "default": false
        },
        "stopOnIssues": {
          "type": "boolean",
          "description": "Whether audit issues fail the run with exit code 3 instead of being reported as warnings. XML documentation issues, including the absence of any XML documentation file, stop the run before any page is generated. Invalid links, including fragments that name no anchor, stop the run after the pages are generated, so the build command leaves the generated files in the output directory.",
          "default": false
        }
      },
      "additionalProperties": false
    }
  },
  "additionalProperties": false,
  "required": [
    "outputDirectory"
  ]
}
